{
  "$schema": "../schema/suppliers.schema.json",
  "version": 1,
  "generatedAt": "2026-09-24T16:04:54.571Z",
  "currency": "EUR",
  "vat": "excluded",
  "suppliers": [
    {
      "id": "anwb",
      "name": "ANWB Energie",
      "website": "https://www.anwb.nl/energie",
      "tariffUrl": "https://www.anwb.nl/energie/actuele-tarieven",
      "products": {
        "electricity": true,
        "gas": true
      },
      "features": {
        "autoCurtailment": false,
        "notes": "Basis app-inzicht, geen geautomatiseerde omvormer-stop."
      },
      "tariffs": {
        "electricityFixedMonthly": {
          "value": 5.99,
          "valueInclVat": 7.2479,
          "unit": "EUR/month",
          "source": "manual",
          "verified": false,
          "since": "2026-09-24T00:00:00Z",
          "sourceUrl": null
        },
        "electricityMarkup": {
          "value": 0.014876,
          "valueInclVat": 0.018,
          "unit": "EUR/kWh",
          "source": "manual",
          "verified": true,
          "since": "2026-09-24T00:00:00Z",
          "sourceUrl": "https://www.anwb.nl/energie/actuele-tarieven"
        },
        "gasFixedMonthly": {
          "value": 5.99,
          "valueInclVat": 7.2479,
          "unit": "EUR/month",
          "source": "manual",
          "verified": false,
          "since": "2026-09-24T00:00:00Z",
          "sourceUrl": null
        },
        "gasMarkup": {
          "value": 0.063471,
          "valueInclVat": 0.0768,
          "unit": "EUR/m3",
          "source": "manual",
          "verified": true,
          "since": "2026-09-24T00:00:00Z",
          "sourceUrl": "https://www.anwb.nl/energie/actuele-tarieven"
        },
        "feedInDelta": {
          "value": 0,
          "valueInclVat": 0,
          "unit": "EUR/kWh",
          "source": "manual",
          "verified": true,
          "since": "2026-09-24T00:00:00Z",
          "sourceUrl": "https://www.anwb.nl/energie/actuele-tarieven"
        }
      },
      "lastRun": "2026-09-24T16:04:54.571Z"
    },
    {
      "id": "budget",
      "name": "Budget Thuis (Budget Energie)",
      "website": "https://www.budgetthuis.nl",
      "tariffUrl": "https://www.budgetthuis.nl/energie/dynamisch-energiecontract",
      "products": {
        "electricity": true,
        "gas": true
      },
      "features": {
        "autoCurtailment": false,
        "notes": "Geen actieve omvormersturing via de app."
      },
      "tariffs": {
        "electricityFixedMonthly": {
          "value": 6,
          "valueInclVat": 7.26,
          "unit": "EUR/month",
          "source": "manual",
          "verified": false,
          "since": "2026-09-24T00:00:00Z",
          "sourceUrl": null
        },
        "electricityMarkup": {
          "value": 0.0168,
          "valueInclVat": 0.020328,
          "unit": "EUR/kWh",
          "source": "manual",
          "verified": false,
          "since": "2026-09-24T00:00:00Z",
          "sourceUrl": null
        },
        "gasFixedMonthly": {
          "value": 6,
          "valueInclVat": 7.26,
          "unit": "EUR/month",
          "source": "manual",
          "verified": false,
          "since": "2026-09-24T00:00:00Z",
          "sourceUrl": null
        },
        "gasMarkup": {
          "value": 0.0641,
          "valueInclVat": 0.077561,
          "unit": "EUR/m3",
          "source": "manual",
          "verified": false,
          "since": "2026-09-24T00:00:00Z",
          "sourceUrl": null
        },
        "feedInDelta": {
          "value": -0.0168,
          "valueInclVat": -0.020328,
          "unit": "EUR/kWh",
          "source": "manual",
          "verified": false,
          "since": "2026-09-24T00:00:00Z",
          "sourceUrl": null
        }
      },
      "lastRun": "2026-09-24T16:04:54.571Z"
    },
    {
      "id": "eneco",
      "name": "Eneco",
      "website": "https://www.eneco.nl",
      "tariffUrl": "https://www.eneco.nl/duurzame-energie/dynamisch-energiecontract/dynamische-tarieven/",
      "products": {
        "electricity": true,
        "gas": true
      },
      "features": {
        "autoCurtailment": false,
        "notes": "Koppeling met Toon-app mogelijk."
      },
      "tariffs": {
        "electricityFixedMonthly": {
          "value": 7,
          "valueInclVat": 8.47,
          "unit": "EUR/month",
          "source": "manual",
          "verified": false,
          "since": "2026-09-24T00:00:00Z",
          "sourceUrl": null
        },
        "electricityMarkup": {
          "value": 0.0185,
          "valueInclVat": 0.022385,
          "unit": "EUR/kWh",
          "source": "manual",
          "verified": false,
          "since": "2026-09-24T00:00:00Z",
          "sourceUrl": null
        },
        "gasFixedMonthly": {
          "value": 7,
          "valueInclVat": 8.47,
          "unit": "EUR/month",
          "source": "manual",
          "verified": false,
          "since": "2026-09-24T00:00:00Z",
          "sourceUrl": null
        },
        "gasMarkup": {
          "value": 0.1068,
          "valueInclVat": 0.129228,
          "unit": "EUR/m3",
          "source": "manual",
          "verified": false,
          "since": "2026-09-24T00:00:00Z",
          "sourceUrl": null
        },
        "feedInDelta": {
          "value": -0.0185,
          "valueInclVat": -0.022385,
          "unit": "EUR/kWh",
          "source": "manual",
          "verified": false,
          "since": "2026-09-24T00:00:00Z",
          "sourceUrl": null
        }
      },
      "lastRun": "2026-09-24T16:04:54.571Z"
    },
    {
      "id": "frank",
      "name": "Frank Energie",
      "website": "https://www.frankenergie.nl",
      "tariffUrl": "https://www.frankenergie.nl/nl/dynamisch-energiecontract",
      "products": {
        "electricity": true,
        "gas": true
      },
      "features": {
        "autoCurtailment": true,
        "notes": "Slim Sturen zet automatisch de teruglevering stil als stroom geld kost."
      },
      "tariffs": {
        "electricityFixedMonthly": {
          "value": 5.785124,
          "valueInclVat": 7,
          "unit": "EUR/month",
          "source": "manual",
          "verified": true,
          "since": "2026-09-24T00:00:00Z",
          "sourceUrl": "https://www.frankenergie.nl/nl/dynamisch-energiecontract"
        },
        "electricityMarkup": {
          "value": 0.015,
          "valueInclVat": 0.01815,
          "unit": "EUR/kWh",
          "source": "manual",
          "verified": true,
          "since": "2026-09-24T00:00:00Z",
          "sourceUrl": "https://www.frankenergie.nl/nl/dynamisch-energiecontract"
        },
        "gasFixedMonthly": {
          "value": 5.785124,
          "valueInclVat": 7,
          "unit": "EUR/month",
          "source": "manual",
          "verified": true,
          "since": "2026-09-24T00:00:00Z",
          "sourceUrl": "https://www.frankenergie.nl/nl/dynamisch-energiecontract"
        },
        "gasMarkup": {
          "value": 0.066,
          "valueInclVat": 0.07986,
          "unit": "EUR/m3",
          "source": "manual",
          "verified": true,
          "since": "2026-09-24T00:00:00Z",
          "sourceUrl": "https://www.frankenergie.nl/nl/dynamisch-energiecontract"
        },
        "feedInDelta": {
          "value": -0.0105,
          "valueInclVat": -0.012705,
          "unit": "EUR/kWh",
          "source": "manual",
          "verified": true,
          "since": "2026-09-24T00:00:00Z",
          "sourceUrl": "https://www.frankenergie.nl/nl/dynamisch-energiecontract"
        }
      },
      "lastRun": "2026-09-24T16:04:54.571Z"
    },
    {
      "id": "liveenergy",
      "name": "Live Energy",
      "website": "https://www.liveenergy.nl",
      "tariffUrl": "https://www.liveenergy.nl/dynamisch-energiecontract-1",
      "products": {
        "electricity": true,
        "gas": true
      },
      "features": {
        "autoCurtailment": false,
        "notes": "Geen software-sturing."
      },
      "tariffs": {
        "electricityFixedMonthly": {
          "value": 4.95,
          "valueInclVat": 5.9895,
          "unit": "EUR/month",
          "source": "manual",
          "verified": false,
          "since": "2026-09-24T00:00:00Z",
          "sourceUrl": null
        },
        "electricityMarkup": {
          "value": 0.023,
          "valueInclVat": 0.02783,
          "unit": "EUR/kWh",
          "source": "manual",
          "verified": false,
          "since": "2026-09-24T00:00:00Z",
          "sourceUrl": null
        },
        "gasFixedMonthly": {
          "value": 4.95,
          "valueInclVat": 5.9895,
          "unit": "EUR/month",
          "source": "manual",
          "verified": false,
          "since": "2026-09-24T00:00:00Z",
          "sourceUrl": null
        },
        "gasMarkup": {
          "value": 0.089,
          "valueInclVat": 0.10769,
          "unit": "EUR/m3",
          "source": "manual",
          "verified": false,
          "since": "2026-09-24T00:00:00Z",
          "sourceUrl": null
        },
        "feedInDelta": {
          "value": -0.023,
          "valueInclVat": -0.02783,
          "unit": "EUR/kWh",
          "source": "manual",
          "verified": false,
          "since": "2026-09-24T00:00:00Z",
          "sourceUrl": null
        }
      },
      "lastRun": "2026-09-24T16:04:54.571Z"
    },
    {
      "id": "nextenergy",
      "name": "NextEnergy",
      "website": "https://www.nextenergy.nl",
      "tariffUrl": "https://www.nextenergy.nl/dynamische-energie",
      "products": {
        "electricity": true,
        "gas": true
      },
      "features": {
        "autoCurtailment": true,
        "notes": "App-aansturing om omvormers uit te zetten tijdens negatieve uren."
      },
      "tariffs": {
        "electricityFixedMonthly": {
          "value": 4.950413,
          "valueInclVat": 5.99,
          "unit": "EUR/month",
          "source": "manual",